{
  "request_interval_seconds": 1.0,
  "max_detail_fetches": 30,
  "sources": [
    {
      "id": "ccgp_local_open",
      "name": "\u4e2d\u56fd\u653f\u5e9c\u91c7\u8d2d\u7f51-\u5730\u65b9\u516c\u5f00\u62db\u6807",
      "type": "ccgp_list",
      "url": "https://www.ccgp.gov.cn/cggg/dfgg/gkzb/",
      "stage": "\u62db\u6807\u516c\u544a",
      "enabled": true
    },
    {
      "id": "ccgp_central_open",
      "name": "\u4e2d\u56fd\u653f\u5e9c\u91c7\u8d2d\u7f51-\u4e2d\u592e\u516c\u5f00\u62db\u6807",
      "type": "ccgp_list",
      "url": "https://www.ccgp.gov.cn/cggg/zygg/gkzb/",
      "stage": "\u62db\u6807\u516c\u544a",
      "enabled": true
    },
    {
      "id": "ccgp_local_intention",
      "name": "\u4e2d\u56fd\u653f\u5e9c\u91c7\u8d2d\u7f51-\u5730\u65b9\u91c7\u8d2d\u610f\u5411",
      "type": "ccgp_list",
      "url": "https://www.ccgp.gov.cn/cggg/dfgg/cgyx/",
      "stage": "\u91c7\u8d2d\u610f\u5411",
      "enabled": false,
      "note": "\u5b98\u65b9\u91c7\u8d2d\u610f\u5411\u72ec\u7acb\u7ad9\u5f53\u524d\u5b58\u5728\u8bc1\u4e66/\u63a5\u5165\u95ee\u9898\uff0c\u5f85\u5b9e\u73b0\u4e13\u7528\u8fde\u63a5\u5668"
    },
    {
      "id": "ccgp_central_intention",
      "name": "\u4e2d\u56fd\u653f\u5e9c\u91c7\u8d2d\u7f51-\u4e2d\u592e\u91c7\u8d2d\u610f\u5411",
      "type": "ccgp_list",
      "url": "https://www.ccgp.gov.cn/cggg/zygg/cgyx/",
      "stage": "\u91c7\u8d2d\u610f\u5411",
      "enabled": false,
      "note": "\u5b98\u65b9\u91c7\u8d2d\u610f\u5411\u72ec\u7acb\u7ad9\u5f53\u524d\u5b58\u5728\u8bc1\u4e66/\u63a5\u5165\u95ee\u9898\uff0c\u5f85\u5b9e\u73b0\u4e13\u7528\u8fde\u63a5\u5668"
    },
    {
      "id": "ccgp_local_award",
      "name": "\u4e2d\u56fd\u653f\u5e9c\u91c7\u8d2d\u7f51-\u5730\u65b9\u4e2d\u6807\u6210\u4ea4",
      "type": "ccgp_list",
      "url": "https://www.ccgp.gov.cn/cggg/dfgg/zbgg/",
      "stage": "\u4e2d\u6807\u516c\u544a",
      "enabled": true,
      "max_pages": 10,
      "history_days": 180
    },
    {
      "id": "ccgp_central_award",
      "name": "\u4e2d\u56fd\u653f\u5e9c\u91c7\u8d2d\u7f51-\u4e2d\u592e\u4e2d\u6807\u6210\u4ea4",
      "type": "ccgp_list",
      "url": "https://www.ccgp.gov.cn/cggg/zygg/zbgg/",
      "stage": "\u4e2d\u6807\u516c\u544a",
      "enabled": true,
      "max_pages": 10,
      "history_days": 180
    }
  ],
  "max_pages": 5,
  "history_days": 30,
  "priority_detail_terms": [
    "\u7535\u78c1\u573a\u6d4b\u91cf",
    "\u8fd1\u573a\u6d4b\u91cf",
    "\u8fdc\u573a\u6d4b\u91cf",
    "\u7d27\u7f29\u573a",
    "\u5929\u7ebf\u6d4b\u91cf\u7cfb\u7edf",
    "\u5929\u7ebf\u6d4b\u8bd5\u7cfb\u7edf",
    "\u5fae\u6ce2\u6697\u5ba4",
    "\u7535\u78c1\u4eff\u771f\u8f6f\u4ef6",
    "\u7535\u78c1\u573a\u4eff\u771f",
    "\u8ba1\u7b97\u7535\u78c1\u5b66",
    "\u5168\u6ce2\u4eff\u771f",
    "\u5929\u7ebf\u4eff\u771f",
    "\u96f7\u8fbe\u6563\u5c04\u622a\u9762\u4eff\u771f",
    "rcs\u4eff\u771f",
    "\u76f8\u63a7\u9635\u6821\u51c6",
    "\u6709\u6e90\u76f8\u63a7\u9635",
    "\u9635\u5217\u6821\u51c6",
    "\u5e45\u76f8\u6821\u51c6",
    "\u76f8\u63a7\u9635\u6d4b\u8bd5",
    "\u536b\u661f\u901a\u4fe1\u6d4b\u8bd5",
    "\u536b\u661f\u5929\u7ebf\u6d4b\u8bd5"
  ]
}
