{
  "$schema": "../schemas/sources.schema.json",
  "request_interval_seconds": 1.0,
  "max_detail_fetches": 30,
  "sources": [
    {
      "id": "ccgp_local_open",
      "name": "\u4e2d\u56fd\u653f\u5e9c\u91c7\u8d2d\u7f51-\u5730\u65b9\u516c\u5f00\u62db\u6807",
      "type": "ccgp_list",
      "url": "https://www.ccgp.gov.cn/cggg/dfgg/gkzb/",
      "stage": "\u62db\u6807\u516c\u544a",
      "enabled": true
    },
    {
      "id": "ccgp_central_open",
      "name": "\u4e2d\u56fd\u653f\u5e9c\u91c7\u8d2d\u7f51-\u4e2d\u592e\u516c\u5f00\u62db\u6807",
      "type": "ccgp_list",
      "url": "https://www.ccgp.gov.cn/cggg/zygg/gkzb/",
      "stage": "\u62db\u6807\u516c\u544a",
      "enabled": true
    },
    {
      "id": "ccgp_local_intention",
      "name": "\u4e2d\u56fd\u653f\u5e9c\u91c7\u8d2d\u7f51-\u5730\u65b9\u91c7\u8d2d\u610f\u5411",
      "type": "ccgp_list",
      "url": "https://www.ccgp.gov.cn/cggg/dfgg/cgyx/",
      "stage": "\u91c7\u8d2d\u610f\u5411",
      "enabled": false,
      "note": "\u5b98\u65b9\u91c7\u8d2d\u610f\u5411\u72ec\u7acb\u7ad9\u5f53\u524d\u5b58\u5728\u8bc1\u4e66/\u63a5\u5165\u95ee\u9898\uff0c\u5f85\u5b9e\u73b0\u4e13\u7528\u8fde\u63a5\u5668"
    },
    {
      "id": "ccgp_central_intention",
      "name": "\u4e2d\u56fd\u653f\u5e9c\u91c7\u8d2d\u7f51-\u4e2d\u592e\u91c7\u8d2d\u610f\u5411",
      "type": "ccgp_list",
      "url": "https://www.ccgp.gov.cn/cggg/zygg/cgyx/",
      "stage": "\u91c7\u8d2d\u610f\u5411",
      "enabled": false,
      "note": "\u5b98\u65b9\u91c7\u8d2d\u610f\u5411\u72ec\u7acb\u7ad9\u5f53\u524d\u5b58\u5728\u8bc1\u4e66/\u63a5\u5165\u95ee\u9898\uff0c\u5f85\u5b9e\u73b0\u4e13\u7528\u8fde\u63a5\u5668"
    },
    {
      "id": "ccgp_local_award",
      "name": "\u4e2d\u56fd\u653f\u5e9c\u91c7\u8d2d\u7f51-\u5730\u65b9\u4e2d\u6807\u6210\u4ea4",
      "type": "ccgp_list",
      "url": "https://www.ccgp.gov.cn/cggg/dfgg/zbgg/",
      "stage": "\u4e2d\u6807\u516c\u544a",
      "enabled": true,
      "max_pages": 10,
      "history_days": 180
    },
    {
      "id": "ccgp_central_award",
      "name": "\u4e2d\u56fd\u653f\u5e9c\u91c7\u8d2d\u7f51-\u4e2d\u592e\u4e2d\u6807\u6210\u4ea4",
      "type": "ccgp_list",
      "url": "https://www.ccgp.gov.cn/cggg/zygg/zbgg/",
      "stage": "\u4e2d\u6807\u516c\u544a",
      "enabled": true,
      "max_pages": 10,
      "history_days": 180
    }
  ],
  "max_pages": 5,
  "history_days": 30,
  "priority_detail_terms": [
    "software",
    "cloud",
    "data platform",
    "cybersecurity",
    "medical device",
    "laboratory equipment",
    "construction",
    "energy storage",
    "consulting",
    "training",
    "\u8f6f\u4ef6\u5f00\u53d1",
    "\u6570\u636e\u5e73\u53f0",
    "\u7f51\u7edc\u5b89\u5168",
    "\u533b\u7597\u5668\u68b0",
    "\u5b9e\u9a8c\u5ba4\u8bbe\u5907",
    "\u5efa\u7b51\u5de5\u7a0b",
    "\u50a8\u80fd\u7cfb\u7edf",
    "\u54a8\u8be2\u670d\u52a1"
  ]
}
